{
  "schema_version": "0.1.0",
  "session_id": "session-demo-001",
  "scenario_id": "smoke_inhalation_room_v0",
  "event_id": "event-001",
  "timestamp": "2026-06-22T09:00:00Z",
  "sequence_number": 1,
  "state": {
    "phase": "scene_assessed",
    "scene_assessed": true,
    "ppe_confirmed": false,
    "backup_requested": false,
    "occupant_removed": false,
    "scenario_outcome": "in_progress"
  },
  "is_terminal": false,
  "next_expected_actions": ["confirm_ppe", "request_backup"]
}
